[
  {
    "id": "wood",
    "name": "Wood",
    "env_type": "open_world",
    "attributes": {
      "tiles": [
        {"id": "tree", "probability": 90},
        {"id": "grass", "probability": 10}
      ]
    }
  },
  {
    "id": "dungeon",
    "name": "Dungeon",
    "env_type": "dungeon",
    "attributes": {
      "max_rooms": 8,
      "rooms": []
    }
  }
]
